{"$schema":"https://json-schema.org/draft/2020-12/schema","type":"object","required":["case_id","claim_layer","family","provider_contract","subject_adapter","stimulus","expected"],"properties":{"case_id":{"type":"string","minLength":1},"claim_layer":{"type":"string","minLength":1},"family":{"const":"downgrade"},"provider_contract":{"type":"string","minLength":1},"subject_adapter":{"type":"string","minLength":1},"stimulus":{"type":"object","required":["operation","from_provider","to_provider","allow_fallback"],"properties":{"operation":{"const":"verify-release-admission"},"from_provider":{"type":"object"},"to_provider":{"type":"object"},"allow_fallback":{"const":false}},"additionalProperties":false},"expected":{"type":"object","required":["failure_code"],"properties":{"failure_code":{"const":"incompatible-contract"}},"additionalProperties":false}},"additionalProperties":false}
