{"case_id":"gateway-client-conformance-downgrade","claim_layer":"gateway-client-conformance","family":"downgrade","provider_contract":"pigloros.fixture.gateway-client-conformance@1.0.0","subject_adapter":"public-gateway-protocol","stimulus":{"operation":"verify-release-admission","from_provider":{"provider_id":"pigloros.fixture.gateway-client-conformance","contract_version":"1.0.0","abi_major":1,"abi_minor":1},"to_provider":{"provider_id":"pigloros.fixture.gateway-client-conformance","contract_version":"1.0.0","abi_major":1,"abi_minor":0},"allow_fallback":false},"expected":{"failure_code":"incompatible-contract"}}
