{"case_id":"artifact-integrity-downgrade","claim_layer":"artifact-integrity","family":"downgrade","provider_contract":"pigloros.fixture.artifact-integrity@1.0.0","subject_adapter":"exported-artifact","stimulus":{"operation":"verify-release-admission","from_provider":{"provider_id":"pigloros.fixture.artifact-integrity","contract_version":"1.0.0","abi_major":1,"abi_minor":1},"to_provider":{"provider_id":"pigloros.fixture.artifact-integrity","contract_version":"1.0.0","abi_major":1,"abi_minor":0},"allow_fallback":false},"expected":{"failure_code":"incompatible-contract"}}
